source,title,url,summary,tags,published,score,Primary,Secondary,group_id,group_size
Business of Fashion,"Off-Price Retailer Brand Alley Has Acquired The Edit Ldn, a Sneaker Resale Platform",https://www.businessoffashion.com/news/sports/off-price-retailer-brand-alley-has-acquired-the-edit-ldn-a-sneaker-resale-platform/,"The sale comes after the sneaker platform, which recently attracted investment from several athletes, experienced cash flow issues towards the end of last year.",[],2024-01-12T17:56:46,10,INDUSTRY,"M&A, FINANCIALS",ungrouped,1
WWD,Inside the Challenges Befalling Black-owned Brands in 2025 — and How They’re Facing Them,https://wwd.com/beauty-industry-news/beauty-features/black-owned-brands-diversity-equity-inclusion-2025-1237953617/,"Black founders and executives weigh in on how M&#38;A slowdowns and diversity, equity and inclusion rollbacks are challenging their businesses.","['Beauty Features', 'investment', 'retail']",2025-07-01T04:01:00,10,INDUSTRY,"M&A, RETAIL STRATEGY",ungrouped,1
Business of Fashion,"Supreme’s Sale to EssilorLuxottica, Explained",https://www.businessoffashion.com/articles/sports/supreme-sale-vf-corp-essilorluxottica/,North Face owner VF Corp is selling the streetwear juggernaut to the Italian eyewear giant for $1.5 billion in cash. BoF breaks down the deal.,[],2024-07-17T21:12:31,10,INDUSTRY,"M&A, FINANCIALS",ungrouped,1
Glossy,Beauty & Wellness Briefing: What’s up with beauty’s executive musical chairs?,https://www.glossy.co/beauty/beauty-wellness-briefing-whats-up-with-beautys-executive-musical-chairs/?utm_campaign=glossydis&utm_medium=rss&utm_source=general-rss,"Why have so many beauty executives changed roles this year? This week, I checked in with esteemed executive recruiters and industry experts to unpack the many executive hirings and departures happening across the beauty industry. Additionally, Unilever and L’Oréal Group make splashy acquisitions, Ulta Beauty’s CFO suddenly departs, and Neutrogena owner Kenvue plans for dozens of corporate layoffs.","['Beauty', 'Wellness', 'Glossy+', 'plus']",2025-07-01T04:02:00,10,INDUSTRY,"M&A, FINANCIALS, RETAIL STRATEGY",ungrouped,1
Business of Fashion,Watches of Switzerland Warns US Tariffs to Weigh on Margin,https://www.businessoffashion.com/news/luxury/watches-of-switzerland-us-tariffs-margin/,The UK-based luxury watch retailer said its margin on earnings before interest and taxes risks slipping by as much as 100 basis points compared with the previous 12 months.,[],2025-07-03T10:59:31,10,INDUSTRY,"FINANCIALS, TARIFFS/SUPPLY CHAIN",ungrouped,1
Glossy,Can the body mist category grow up?,https://www.glossy.co/beauty/can-the-body-mist-category-grow-up/?utm_campaign=glossydis&utm_medium=rss&utm_source=general-rss,"Many new body-mist launches are explicitly targeting the lucrative Gen-Z and Gen-Alpha fragrance consumer. But with the category growing more crowded, others are experimenting with body mists featuring sophisticated scents, high-touch packaging, and additional skin and hair benefits to stand out as more than just an appeal to wallet-conscious teens and tweens.",['Beauty'],2025-06-30T04:03:00,9,FRAGRANCE,"GEN Z, NEW LAUNCH",ungrouped,1
Business of Fashion,The Debrief | Fashion Tech Boom 2.0,https://www.businessoffashion.com/podcasts/technology/the-debrief-fashion-tech-boom-20/,"Investor interest in fashion tech is back, but this time, is it more substance than style? Malique Morris joins The Debrief to discuss how startups with real technical expertise and practical AI tools are leading a new wave of innovation.",[],2025-07-02T18:25:41,9,INDUSTRY,"GEN Z, AI",ungrouped,1
Glossy,The fragrance brands dominating Instagram are not the same ones making bank on TikTok,https://www.glossy.co/beauty/the-fragrance-brands-dominating-instagram-are-not-the-same-ones-making-bank-on-tiktok/?utm_campaign=glossydis&utm_medium=rss&utm_source=general-rss,"Luxury brands like Parfums de Marly and Kilian dominated Instagram for the month of May, according to a new report from Mintoiro. The more polished aesthetic dominant on Instagram does not always translate well to TikTok’s more DIY appeal, however.",['Beauty'],2025-06-25T04:04:00,9,FRAGRANCE,"TIKTOK, GEN Z",ungrouped,1
Beauty Independent,SV Labs Creates Launch Lab Manufacturing Platform To Help Brands Capitalize On Buzz,https://www.beautyindependent.com/sv-labs-creates-launch-lab-manufacturing-platform-help-brands-capitalize-buzz/,"For beauty brands, the race to stay relevant is faster than ever. TikTok-driven micro-trends, influencer collaborations and limited-run drops can explode in hours, leaving them scrambling to keep pace. E-commerce now accounts for roughly 41% of American beauty and personal care sales, and TikTok Shop has already climbed to ... The post SV Labs Creates Launch Lab Manufacturing Platform To Help Brands Capitalize On Buzz appeared first on Beauty Independent .","['Sponsored Content', 'beauty brands', 'coman', 'contract manufacturing', 'Launch Lab', 'manufacturing', 'production', 'speed', 'speed to market', 'SV', 'SV Labs', 'trends']",2025-07-01T04:01:09,8,BRAND,"NEW LAUNCH, RETAIL STRATEGY, TIKTOK, SPEED TO MARKET",ungrouped,1
Glossy,"Exclusive: Versed lands at Ulta Beauty, backed by its biggest influencer push yet",https://www.glossy.co/beauty/exclusive-versed-lands-at-ulta-beauty-backed-by-its-biggest-influencer-push-yet/?utm_campaign=glossydis&utm_medium=rss&utm_source=general-rss,"Six years after its debut, Versed, the affordable beauty brand launched by Katherine Power, is launching at 300 Ulta Beauty doors on July 7. It is available on Ultabeauty.com as of July 1. The move comes on the heels of the brand's introduction of color cosmetics in February, when it introduced a makeup collection with 14 new products at Target, which, apart from its DTC site, has been its sole retailer.","['Beauty', 'Pop']",2025-07-01T04:00:00,8,RETAIL,"NEW LAUNCH, RETAIL STRATEGY",ungrouped,1
WWD,How Much Beauty’s 10 Biggest Brands on TikTok Shop Made in May — From Tarte to Maybelline,https://wwd.com/beauty-industry-news/beauty-features/tarte-maybelline-medicube-anua-tiktok-shop-1237948614/,"A breakdown of the top 10 beauty brands by TikTok Shop sales during the month of May, per Charm.io, plus their respective top-selling products.","['Beauty Features', 'makeup', 'retail', 'skincare', 'Social Media', 'viral']",2025-07-01T04:01:00,7,RETAIL,"TIKTOK, RETAIL STRATEGY",ungrouped,1
Beauty Independent,Will Tariffs Doom K-Beauty’s Boom?,https://www.beautyindependent.com/k-beauty-tariffs/,"As the beauty industry cashes in on K-Beauty’s second wave, retailers, e-tailers and brands are bracing for damaging ripple effects if President Donald Trump doesn’t extend his 90-day pause on “reciprocal tariffs” ending on Wednesday. Already squeezed by a 10% baseline tariff rate Trump started to impose April 5 on goods from most countries ... The post Will Tariffs Doom K-Beauty’s Boom? appeared first on Beauty Independent .","['Retail Report', 'beauty boutique', 'beauty e-commerce', 'beauty retail', 'k-beauty', 'K-beauty trends', 'Ohlolly', 'Olive Young', 'Playlab Beauty', 'retail', 'small retailers', 'tariffs']",2025-07-03T04:01:21,7,INDUSTRY,TARIFFS/SUPPLY CHAIN,ungrouped,1
Business of Fashion,A Memo to Elliott Hill on His First Day at Nike,https://www.businessoffashion.com/articles/sports/a-memo-to-nike-new-ceo/,"The new CEO has a monumental task ahead of him as he begins work on Nike’s turnaround strategy.  Success means resetting expectations, showing evidence of meaningful innovation, recapturing the attention of sneakerheads and earning the trust of retailers.",[],2024-10-14T04:30:00,7,INDUSTRY,RETAIL STRATEGY,ungrouped,1
Business of Fashion,Tomorrow Ltd Acquires Samuel Ross’ A-Cold-Wall,https://www.businessoffashion.com/articles/sports/tomorrow-ltd-acquires-samuel-ross-a-cold-wall/,"After buying out the designer’s stake, the London-based brand accelerator now owns 100 percent of the label.",[],2024-02-21T11:15:45,7,INDUSTRY,M&A,ungrouped,1
Business of Fashion,Luxury Resale Platform Cudoni Shuts Down,https://www.businessoffashion.com/news/retail/luxury-resale-platform-cudoni-shuts-down/,The London-based start-up said the current economic climate had made it “impossible” to continue doing business.,[],2023-04-21T11:05:33,7,INDUSTRY,FINANCIALS,ungrouped,1
Business of Fashion,Adidas’ Plans for Yeezy: What We Know,https://www.businessoffashion.com/articles/sports/adidas-earnings-yeezy-turnaround-plan-bjorn-gulden/,"The German sportswear giant hinted it could try to sell already produced sneakers from the collaboration, but predicted its first annual loss in over three decades.",[],2023-03-08T12:17:18,7,INDUSTRY,FINANCIALS,ungrouped,1
Business of Fashion,Why Salomon-Owner Amer Sports’ IPO Fell Short,https://www.businessoffashion.com/articles/sports/amer-ipo-salomon-arcteryx/,"After discounting its listing, the sportswear group, which also owns Arc’teryx and Wilson, became the latest big fashion company to confront the tepid US IPO market.",[],2024-02-02T00:21:49,7,INDUSTRY,FINANCIALS,ungrouped,1
Business of Fashion,France Fines Retailer Shein €40 Million for Misleading Discounts,https://www.businessoffashion.com/news/retail/france-fines-shein-40-million-euros-investigation/,"Fast-fashion retailer Shein has been fined €40 million for deceptive business practices, after a nearly year-long investigation found that a significant percentage of advertised deals were not genuine.",[],2025-07-03T13:18:52,7,INDUSTRY,FINANCIALS,ungrouped,1
Business of Fashion,"Nike’s Latest Sports Headache, Explained",https://www.businessoffashion.com/articles/sports/nike-barcelona-kit-dispute-sportswear-joan-laporta/,FC Barcelona may take its on-field kit and fan merchandise in-house after falling out with Nike. Football industry executives and rival sportswear brands will be watching its next moves closely.,[],2024-03-12T05:30:00,7,INDUSTRY,RETAIL STRATEGY,ungrouped,1
Beauty Independent,“Not Always About The Best Product”: VC McKeever Conwell On What Really Drives CPG Success,https://www.beautyindependent.com/vc-mckeever-conwell-drives-cpg-success/,"If you wanted to get on the radar of investor McKeever Conwell five years ago, all you had to do was slide into his Twitter DMs. Back then, he was fundraising for RareBreed Ventures, a pre-seed and seed-stage fund. While he had worked for Maryland Technology Development Council (TedCo) backing underrepresented founders and ... The post “Not Always About The Best Product”: VC McKeever Conwell On What Really Drives CPG Success appeared first on Beauty Independent .","['Full Disclosure', 'CPG', 'early stage investing', 'funding', 'fundraising', 'haircare', 'investment', 'investor', 'mckeever conwell', 'rare breed ventures', 'rarebreed ventures', 'vc', 'VC funding', 'venture capital']",2025-07-01T10:01:16,7,INDUSTRY,"INVESTMENT, FUNDRAISING",ungrouped,1
Beauty Independent,The Wow Factors Behind L’Oréal’s Estimated $1B Color Wow Buy,https://www.beautyindependent.com/loreal-color-wow-buy/,"The billion-dollar(ish) beauty brand deal spree continues. On Monday, L’Oréal announced it’s acquiring Color Wow , the haircare brand recognized for innovative products to protect colored hair, touch up roots and ward off frizz, for an undisclosed amount. Multiple industry sources report that ... The post The Wow Factors Behind L’Oréal’s Estimated $1B Color Wow Buy appeared first on Beauty Independent .","['Deal Flow', 'Amika', 'beauty deals', 'Color Wow', 'Dealmaker Summit', 'DP Hue', 'hair', 'hair care', 'haircare', 'L’Oreal', 'M&A', 'professional haircare']",2025-07-01T22:31:50,7,INDUSTRY,M&A,ungrouped,1
Business of Fashion,"For Retailers, US-Vietnam Trade Deal Leaves Questions",https://www.businessoffashion.com/articles/retail/us-tariffs-nike-adidas-vietnam-trade-deal/,New US tariffs on Vietnamese imports create uncertainty for sportswear and clothing retailers like Nike and Adidas.,[],2025-07-04T09:47:43,7,INDUSTRY,TARIFFS/SUPPLY CHAIN,ungrouped,1
WWD,L’Oréal Acquires Color Wow,https://wwd.com/beauty-industry-news/hair/loreal-acquires-hair-care-brand-color-wow-1237961652/,The hair care brand started by serial entrepreneur Gail Federici will live in the Professional Products Division.,"['Hair', 'hair care', 'L’Oréal']",2025-06-30T16:15:00,7,INDUSTRY,M&A,ungrouped,1
Business of Fashion,Can Adidas Move On From Yeezy?,https://www.businessoffashion.com/articles/sports/adidas-yeezy-kanye-west/,Top of incoming CEO Bjørn Gulden’s in-tray will be dealing with unsold Yeezy inventory and reversing the brand’s steep decline in China.,[],2022-11-10T05:30:00,7,BRAND,"FINANCIALS, RETAIL STRATEGY",ungrouped,1
Business of Fashion,"Giorgio Armani Posts 24% Profit Drop in Tough 2024, Steps Up Investments",https://www.businessoffashion.com/news/luxury/giorgio-armani-24-percent-profit-drop-2024-results-earnings/,The Milanese group was hit by declining revenues and a slight increase in operating costs but said it retained a long-term approach amid a sharp downturn in luxury demand.,[],2025-07-02T16:14:27,7,INDUSTRY,FINANCIALS,ungrouped,1
Business of Fashion,Fast-Fashion Giant Shein Plans $2.3 Billion Supply Chain Hub,https://www.businessoffashion.com/news/news-analysis/fast-fashion-giant-shein-plans-23-supply-chain-hub/,The Chinese fast-fashion retailer plans to invest 15 billion yuan ($2.3 billion) to build a global supply chain centre in Guangzhou.,[],2022-02-11T15:46:36,7,INDUSTRY,TARIFFS/SUPPLY CHAIN,ungrouped,1
Business of Fashion,"Fast Fashion’s M&A Frenzy, Explained",https://www.businessoffashion.com/articles/retail/uk-fast-fashion-mergers-and-acquisitions/,"Amid a spending slowdown and steep competition, the UK fast-fashion players including Asos and Frasers Group are selling off struggling brands.",[],2023-11-03T05:27:00,7,INDUSTRY,M&A,ungrouped,1
Business of Fashion,Trump Announces Vietnam Trade Deal With 20% Import Tariff,https://www.businessoffashion.com/news/retail/trump-announces-vietnam-trade-deal-with-20-import-tariff/,President Donald Trump said he had reached a trade deal with Vietnam following weeks of intense diplomacy between the nations and ahead of a deadline next week that would have seen higher tariffs imposed on the country’s imports.,[],2025-07-02T16:37:32,7,INDUSTRY,TARIFFS/SUPPLY CHAIN,ungrouped,1
Business of Fashion,How Golf Fashion Made It to Gen-Z’s For You Page,https://www.businessoffashion.com/articles/sports/how-golf-fashion-made-it-to-gen-z-fore-you-page-4/,Brands are making golf fashionable for women through unexpected collaborations and creator content that flips the sport’s once elitist connotation on its head.,[],2025-07-03T04:30:00,6,MARKETING,"GEN Z, TIKTOK, PARTNERSHIP",ungrouped,1
Glossy,‘Counting likes is no longer enough’: Beauty brands rethink strategy as a wellness focus becomes business-critical,https://www.glossy.co/beauty/counting-likes-is-no-longer-enough-beauty-brands-rethink-strategy-as-a-wellness-focus-becomes-business-critical/?utm_campaign=glossydis&utm_medium=rss&utm_source=general-rss,"At a Glossy, CEW and Launchmetrics panel in London this week, beauty leaders gathered to discuss how the rise of wellness is reshaping brand strategy in the saturated, fast-moving world of beauty.","['Beauty', 'Wellness']",2025-06-27T04:01:00,6,BRAND,"GEN Z, RETAIL STRATEGY",ungrouped,1
Business of Fashion,Where Does Nike Go From Here?,https://www.businessoffashion.com/briefings/sports/where-does-nike-go-from-here/,"With pressure mounting on CEO John Donahoe, the sportswear giant’s precise turnaround plan remains unclear. But the rehiring of Nike veteran Tom Peddie this week offered more clues on the brand’s direction.",[],2024-07-12T15:03:03,6,BRAND,"NEW LAUNCH, RETAIL STRATEGY",ungrouped,1
Business of Fashion,Japan’s Department Store Shares Lag as Tourist Splurge Slows,https://www.businessoffashion.com/news/global-markets/japan-department-store-shares-fall-tourists-slow/,Low confidence stemming from economic uncertainty has crimped tourist budgets with data compiled by the Japan Department Stores Association showing tax-free inbound sales at over 80 department stores across the country fell by 41 percent in May from a year earlier.,[],2025-07-03T11:18:56,6,RETAIL,FINANCIALS,ungrouped,1
Business of Fashion,Hugo Boss’ Hugo Brand to Sponsor VCARB F1 Team,https://www.businessoffashion.com/news/sports/f1-hugo-boss/,The German retailer’s Gen-Z label will design apparel and eyewear for the newly rebranded Visa Cash App RB team.,[],2024-02-09T05:30:00,6,MARKETING,"PARTNERSHIP, GEN Z",ungrouped,1
Glossy,Luxury Briefing: Can Jonathan Anderson turn Dior’s best-selling Book Tote into a fresh growth engine?,https://www.glossy.co/fashion/luxury/luxury-briefing-can-jonathan-anderson-turn-diors-best-selling-book-tote-into-a-fresh-growth-engine/?utm_campaign=glossydis&utm_medium=rss&utm_source=general-rss,"In this week's luxury briefing, a look at the revival of Dior's book tote. Also, a new shopping app that claims to fuel brand loyalty, the latest executive moves from Miu Miu and YNAP, and news to know.","['Fashion', 'Luxury', 'Glossy+', 'plus']",2025-06-25T04:02:00,6,BRAND,"NEW LAUNCH, RETAIL STRATEGY",ungrouped,1
Business of Fashion,A New Era of Fashion-Carmaker Collaborations,https://www.businessoffashion.com/articles/sports/a-new-era-of-fashion-carmaker-collaborations/,"From Rimowa’s new tie-up with Porsche to Mercedes teaming up with Palace, a new wave of fashion-carmaker partnerships is targeting a younger generation of aspirational consumers.",[],2022-04-11T04:30:00,6,MARKETING,"PARTNERSHIP, GEN Z",ungrouped,1
Glossy,Glossy Pop Newsletter: Sabrina Carpenter’s music videos are the new billboard for beauty brands,https://www.glossy.co/beauty/glossy-pop-newsletter-sabrina-carpenters-music-videos-are-the-new-billboard-for-beauty-brands/?utm_campaign=glossydis&utm_medium=rss&utm_source=general-rss,"Music videos are the hot new place for beauty and fashion brands to show up. In Sabrina Carpenter and Addison Rae videos, brands like Prada Beauty, Supergoop and Free People are making the most of the opportunity.","['Beauty', 'Fashion', 'Pop', 'RevolutionBrandMarketingContentful']",2025-06-27T04:02:00,6,MARKETING,"PARTNERSHIP, GEN Z",ungrouped,1
Glossy,"Glossy Podcast: NBA Draft fashion, Skims x Cavalli and LVMH’s flip-flops — plus,  Lisa Yamner Green on the launch of Daydream",https://www.glossy.co/podcasts/glossy-podcast-nba-draft-fashion-skims-x-cavalli-and-lvmhs-flip-flops-plus-lisa-yamner-green-on-the-launch-of-daydream/?utm_campaign=glossydis&utm_medium=rss&utm_source=general-rss,"This week on the Glossy Podcast: NBA Draft fashion goes luxury, Skims taps the Cavalli archive, men’s flip flops hit the runway and Daydream’s Lisa Yamner Green shares how AI is reshaping fashion discovery.","['Fashion', 'Podcasts']",2025-06-27T04:00:00,6,MARKETING,"PARTNERSHIP, GEN Z",ungrouped,1
Glossy,"Glossy Pop Newsletter: When it comes to brand trips, is all press good press?",https://www.glossy.co/pop/glossy-pop-newsletter-when-it-comes-to-brand-trips-is-all-press-good-press/?utm_campaign=glossydis&utm_medium=rss&utm_source=general-rss,"Over the weekend, TikTok was flooded with posts of major influencers partying in Tulum with the electrolytes brand Waterboy. At the same time, dozens of posts criticizing the brand’s social media strategy for the trip began circulating: Why weren't the influencers showing the products? And don't electrolytes help thwart hangovers? Why, then, were they posting about how hungover they were? The marketing experts on TikTok (read: everyone) had questions.","['Beauty', 'Pop', 'Wellness']",2025-07-04T04:02:00,6,MARKETING,"TIKTOK, GEN Z",ungrouped,1
Glossy,"Luxury Briefing: As Wimbledon kicks off, tenniscore gets a fashion-forward update",https://www.glossy.co/fashion/luxury/as-wimbledon-kicks-off-tenniscore-gets-a-fashion-forward-update/?utm_campaign=glossydis&utm_medium=rss&utm_source=general-rss,"In this week's luxury briefing, we dive into how luxury fashion is approaching a post-""Challengers"" tennis fashion landscape at Wimbledon and beyond. Also, why casualization is happening in men's fashion, what products luxury customers are actually buying, executive moves, the latest Glossy Podcast and news to know.","['Fashion', 'Luxury', 'Glossy+', 'plus']",2025-07-02T04:03:00,6,MARKETING,"GEN Z, RETAIL STRATEGY",ungrouped,1
Business of Fashion,Athletes Don’t Want Nike or Adidas Anymore. They Want Independence.,https://www.businessoffashion.com/articles/sports/athletes-endorsement-nike-adidas-fctry-lab/,"Young stars increasingly favour deals with lesser known brands that align with their personal values and allow them to play a bigger role, creatively and commercially.",[],2024-07-15T04:28:00,6,BRAND,"PARTNERSHIP, GEN Z",ungrouped,1
Glossy,"How Estée Lauder-owned Aveda leveraged its hairdresser community to create, test and launch its newest hero product",https://www.glossy.co/beauty/how-estee-lauder-owned-aveda-leveraged-its-hairdresser-community-to-create-test-and-launch-its-newest-hero-product/?utm_campaign=glossydis&utm_medium=rss&utm_source=general-rss,Hair-care brand Aveda is betting big on its newest launch thanks to help from its community of hair pros. Glossy sat down with ELC exec Shane Wolf to learn about Monday's launch of its Miraculous Oil High-Shine Hair Concentrate.,"['Beauty', 'RevolutionBrandMarketingContentful']",2025-07-01T16:00:00,5,BRAND,"NEW LAUNCH, PARTNERSHIP",ungrouped,1
Business of Fashion,Nike’s Jordan Brand to Open First Flagship in Milan,https://www.businessoffashion.com/articles/sports/nike-jordan-milan-flagship/,"Nike’s Jordan brand, created in collaboration with NBA All-Star Michael Jordan, is set to open its first dedicated retail flagship in Milan later this month.",[],2022-12-06T05:30:00,5,RETAIL,NEW LAUNCH,ungrouped,1
Business of Fashion,Amazon Launches ‘Luxury Stores’ Platform in Europe,https://www.businessoffashion.com/news/retail/amazon-launches-luxury-stores-platform-in-europe/,"The e-commerce giant’s luxury fashion vertical, first introduced in the US in September 2020, is now available in the UK, Germany, France, Italy and Spain.",[],2022-06-08T06:00:00,5,RETAIL,NEW LAUNCH,ungrouped,1
Glossy,"Unilever’s new acquisition, Glossier’s CEO shakeup — plus, Arrae’s Siff Haider on forecasting wellness trends before they hit big",https://www.glossy.co/podcasts/how-siff-haider-co-founder-of-arrae-forecasts-wellness-trends-before-they-hit-it-big/?utm_campaign=glossydis&utm_medium=rss&utm_source=general-rss,"In the big wide world of health and wellness, there is always a buzzword du jour. In the past couple months, you've likely heard buzz about gut health and GLP-1s, ingredients like creatine and colostrum, and, of course, protein. For many of these trends, Arrae, the supplement brand co-founded by Siffat ""Siff"" Haider and her husband, Nishant Samantray, has been right there, answering consumer demand with a product featuring that of-the-moment ingredient or speaking to a top-of-mind concern.","['Beauty', 'Podcasts']",2025-06-26T04:00:00,5,BRAND,"NEW LAUNCH, GEN Z",ungrouped,1
WWD,"With WhatsApp Partnership, L’Oréal Paris Wants People to Ask Beauty Genius — Not ChatGPT — for Beauty Help",https://wwd.com/beauty-industry-news/beauty-features/loreal-paris-ai-beauty-genius-whatsapp-1237952933/,"After soft-launching the generative AI-powered beauty advice and education tool in October, L'Oréal Paris is gearing up to go wider with Beauty Genius.","['Beauty Features', 'beauty industry', 'innovation', 'launch', 'Technology']",2025-07-01T04:01:00,5,BRAND,"PARTNERSHIP, TECHNOLOGY",ungrouped,1
WWD,MAC Cosmetics Debuts ‘Musical Spaceship’ Concept for Nanjing Flagship,https://wwd.com/beauty-industry-news/color-cosmetics/mac-cosmetics-deji-flagship-1237960855/,"Designed by the Chinese architect Li Xiang of X+Living, the centerpiece of the space is a deconstructed piano that doubles as merchandise display.","['Color Cosmetics', 'China', 'MAC']",2025-06-30T07:43:17,5,BRAND,"NEW LAUNCH, RETAIL STRATEGY",ungrouped,1
Business of Fashion,Highsnobiety’s New Store That Isn’t a Store,https://www.businessoffashion.com/articles/sports/highsnobiety-fashion-week-collaborations/,"At least not in the traditional sense. A soon-to-launch Berlin flagship will sell stuff, but it’s brand partnerships that are expected to make the company’s latest retail experiment work.",[],2024-02-23T05:30:00,5,RETAIL,PARTNERSHIP,ungrouped,1
Business of Fashion,Reliance Retail Invests in Facial Chain Facegym,https://www.businessoffashion.com/news/beauty/reliance-invests-facegym/,The partnership will bring Facegym’s signature treatments to the Indian market through both standalone studios and spaces within its Tira beauty stores.,[],2025-07-03T12:15:45,5,RETAIL,PARTNERSHIP,ungrouped,1
Business of Fashion,Adidas to Launch Fear of God Athletics Collaboration in Second Half of 2023,https://www.businessoffashion.com/news/sports/adidas-to-launch-fear-of-god-athletics-collaboration-in-second-half-of-2023/,Chief executive Bjorn Gulden confirmed the release date of the long-awaited tie-up on an earnings call with media Friday morning.,[],2023-05-05T09:43:31,5,BRAND,"NEW LAUNCH, PARTNERSHIP",ungrouped,1
Glossy,"With Dedcool, Erewhon launches its first fragrance-inspired smoothie",https://www.glossy.co/beauty/with-dedcool-erewhon-launches-its-first-fragrance-inspired-smoothie/?utm_campaign=glossydis&utm_medium=rss&utm_source=general-rss,"With the launch of a limited-edition vegan smoothie, Dedcool's Xtra Milk perfume is the latest product to get the coveted Erewhon smoothie treatment.","['Beauty', 'RevolutionBrandMarketingContentful']",2025-07-02T04:01:00,5,MARKETING,"NEW LAUNCH, PARTNERSHIP",ungrouped,1
